{
  "format": "cablepilot-project",
  "version": 7,
  "id": "sample-dc-charger",
  "name": "Caricabatterie 110 V DC",
  "settings": {
    "bom": {
      "columns": [
        "designation",
        "position",
        "qty",
        "code",
        "description",
        "manufacturer",
        "field:make",
        "field:notes"
      ],
      "group": "device",
      "units": 1,
      "userFields": [
        {"id":"make","label":{"en":"Make or buy","it":"Produzione o acquisto"}},
        {"id":"notes","label":{"en":"Notes","it":"Note"}}
      ]
    },
    "crossRef": {"format":"page-column-row","pageDigits":2},
    "defaultSize": "A3",
    "defaultTemplateId": "default",
    "drawingLanguage": "it",
    "installationMethod": "B1",
    "layout": {"ductFillMax":50,"gap":5,"rowClearance":20,"slack":100,"sparePct":20},
    "numbering": {"pattern":"{n:3}{suffix}","scheme":"potential","start":1,"step":1},
    "plc": {"start":{"ai":64,"ao":64,"di":0,"do":0},"style":"siemens"},
    "style": {
      "colours": {
        "annotation": "#000000",
        "designation": "#d40000",
        "frame": "#000000",
        "symbol": "#000000",
        "text": "#000000",
        "titleBlock": "#000000",
        "wire": "#000000",
        "wireNumber": "#d40000"
      },
      "font": "sans",
      "textSizes": {"designation":3.5,"text":3.5,"wireNumber":2.5},
      "weights": {"annotation":0.35,"frame":0.7,"symbol":0.35,"wire":0.35}
    },
    "supply": {"ambient":30,"grouping":1,"ik":0,"maxDropPct":5,"voltage":400},
    "symbolStandard": "iec",
    "wireColours": true
  },
  "properties": {
    "approved": "Direzione",
    "checked": "Ufficio tecnico",
    "client": "Cliente di esempio S.r.l.",
    "copyright": "Progetto di esempio di CablePilot. Solo dati di esempio.",
    "drawingNo": "SMP-CHG-001",
    "drawn": "CablePilot",
    "issueDate": "2026-10-24",
    "orderNo": "ESEMPIO-0003",
    "product": "Quadro caricabatterie 110 V DC",
    "revision": "1"
  },
  "assembly": {
    "batteryCapacity": "100",
    "batteryNominalVoltage": "110",
    "batteryType": "Piombo-acido ermetico",
    "dcOutputCurrent": "30",
    "dcOutputVoltage": "110",
    "earthingSystem": "TN-S",
    "enclosureMaterial": "Lamiera di acciaio verniciata",
    "formOfSeparation": "1",
    "installation": "indoor",
    "ipDegree": "IP31",
    "mobility": "fixed",
    "ratedCurrent": "40",
    "ratedDiversityFactor": "1",
    "ratedFrequency": "50",
    "ratedImpulseVoltage": "6",
    "ratedInsulationVoltage": "690",
    "ratedOperationalVoltage": "400",
    "ratedShortTimeCurrent": "10"
  },
  "templates": [
    {
      "id": "default",
      "name": "Default",
      "frame": {
        "columns": ["A","B","C","D","E","F","G","H","M","N","P","R","S","T","U"],
        "margins": {"b":10,"l":20,"r":10,"t":10},
        "rows": ["0","1","2","3","4","5","6","7","8","9"]
      },
      "titleBlock": {
        "cells": [
          {"h":36,"key":"logo","w":40,"x":0,"y":0},
          {"h":9,"key":"client","w":70,"x":40,"y":0},
          {"h":9,"key":"product","w":70,"x":110,"y":0},
          {"h":9,"key":"sheetTitle","w":140,"x":40,"y":9},
          {"h":9,"key":"drawingNo","w":50,"x":40,"y":18},
          {"h":9,"key":"orderNo","w":30,"x":90,"y":18},
          {"h":9,"key":"issueDate","w":30,"x":120,"y":18},
          {"h":9,"key":"revision","w":30,"x":150,"y":18},
          {"h":9,"key":"drawn","w":30,"x":40,"y":27},
          {"h":9,"key":"checked","w":30,"x":70,"y":27},
          {"h":9,"key":"approved","w":30,"x":100,"y":27},
          {"h":9,"key":"sheet","w":17.5,"x":130,"y":27},
          {"h":9,"key":"nextSheet","w":17.5,"x":147.5,"y":27},
          {"h":9,"key":"totalSheets","w":15,"x":165,"y":27}
        ],
        "h": 36,
        "logoAssetId": "logo-esempio",
        "w": 180
      }
    }
  ],
  "potentials": [
    {"id":"L1","kind":"ac","label":"L1"},
    {"id":"L2","kind":"ac","label":"L2"},
    {"id":"L3","kind":"ac","label":"L3"},
    {"id":"N","kind":"neutral","label":"N"},
    {"id":"PE","kind":"pe","label":"PE"},
    {"id":"L+","kind":"dc-plus","label":"L+"},
    {"id":"L-","kind":"dc-minus","label":"L−"},
    {"id":"24VDC","kind":"dc-plus","label":"24 V DC"},
    {"id":"0V","kind":"dc-minus","label":"0 V"},
    {"id":"110VDC","kind":"dc-plus","label":"110 V DC"}
  ],
  "pages": [
    {
      "id": "p1",
      "type": "cover",
      "elements": [],
      "size": "A3",
      "templateId": "",
      "title": {"en":"Cover sheet","it":"Copertina"}
    },
    {
      "id": "p2",
      "type": "contents",
      "elements": [],
      "size": "A3",
      "templateId": "",
      "title": {"en":"Contents","it":"Indice"}
    },
    {
      "id": "p3",
      "type": "data",
      "elements": [
        {
          "id": "e1",
          "kind": "form",
          "items": [
            {"type":"heading","label":{"en":"Electrical data","it":"Dati elettrici"}},
            {
              "type": "table",
              "label": {"en":"Rated data","it":"Dati nominali"},
              "rows": [
                {
                  "bind": "assembly.ratedOperationalVoltage",
                  "label": {"en":"Rated operational voltage Ue","it":"Tensione nominale di impiego Ue"}
                },
                {
                  "bind": "assembly.ratedInsulationVoltage",
                  "label": {"en":"Rated insulation voltage Ui","it":"Tensione nominale di isolamento Ui"}
                },
                {
                  "bind": "assembly.ratedImpulseVoltage",
                  "label": {
                    "en": "Rated impulse withstand voltage Uimp",
                    "it": "Tensione nominale di tenuta a impulso Uimp"
                  }
                },
                {
                  "bind": "assembly.ratedCurrent",
                  "label": {
                    "en": "Rated current of the assembly InA",
                    "it": "Corrente nominale dell'assieme InA"
                  }
                },
                {
                  "bind": "assembly.ratedShortTimeCurrent",
                  "label": {
                    "en": "Rated short-time withstand current Icw",
                    "it": "Corrente nominale di breve durata Icw"
                  }
                },
                {
                  "bind": "assembly.ratedFrequency",
                  "label": {"en":"Rated frequency","it":"Frequenza nominale"}
                },
                {
                  "bind": "assembly.ratedDiversityFactor",
                  "label": {"en":"Rated diversity factor RDF","it":"Fattore di contemporaneità nominale RDF"}
                }
              ]
            },
            {"type":"heading","label":{"en":"Earthing system","it":"Sistema di distribuzione"}},
            {
              "type": "tick",
              "bind": "assembly.earthingSystem",
              "label": {"en":"TN-S","it":"TN-S"},
              "value": "TN-S"
            },
            {
              "type": "tick",
              "bind": "assembly.earthingSystem",
              "label": {"en":"TN-C","it":"TN-C"},
              "value": "TN-C"
            },
            {
              "type": "tick",
              "bind": "assembly.earthingSystem",
              "label": {"en":"TN-C-S","it":"TN-C-S"},
              "value": "TN-C-S"
            },
            {
              "type": "tick",
              "bind": "assembly.earthingSystem",
              "label": {"en":"TT","it":"TT"},
              "value": "TT"
            },
            {
              "type": "tick",
              "bind": "assembly.earthingSystem",
              "label": {"en":"IT","it":"IT"},
              "value": "IT"
            },
            {"type":"heading","label":{"en":"Mechanical data","it":"Dati meccanici"}},
            {
              "type": "text",
              "bind": "assembly.ipDegree",
              "label": {"en":"Degree of protection (IP)","it":"Grado di protezione (IP)"}
            },
            {
              "type": "text",
              "bind": "assembly.enclosureMaterial",
              "label": {"en":"Enclosure material","it":"Materiale del contenitore"}
            },
            {
              "type": "tick",
              "bind": "assembly.installation",
              "label": {"en":"Indoor","it":"Interno"},
              "value": "indoor"
            },
            {
              "type": "tick",
              "bind": "assembly.installation",
              "label": {"en":"Outdoor","it":"Esterno"},
              "value": "outdoor"
            },
            {
              "type": "tick",
              "bind": "assembly.mobility",
              "label": {"en":"Fixed assembly","it":"Assieme fisso"},
              "value": "fixed"
            },
            {
              "type": "tick",
              "bind": "assembly.mobility",
              "label": {"en":"Movable assembly","it":"Assieme mobile"},
              "value": "movable"
            },
            {
              "type": "heading",
              "label": {"en":"Form of internal separation","it":"Forma di segregazione interna"}
            },
            {
              "type": "tick",
              "bind": "assembly.formOfSeparation",
              "label": {"en":"Form 1","it":"Forma 1"},
              "value": "1"
            },
            {
              "type": "tick",
              "bind": "assembly.formOfSeparation",
              "label": {"en":"Form 2a","it":"Forma 2a"},
              "value": "2a"
            },
            {
              "type": "tick",
              "bind": "assembly.formOfSeparation",
              "label": {"en":"Form 2b","it":"Forma 2b"},
              "value": "2b"
            },
            {
              "type": "tick",
              "bind": "assembly.formOfSeparation",
              "label": {"en":"Form 3a","it":"Forma 3a"},
              "value": "3a"
            },
            {
              "type": "tick",